{
    "$schema": "https://raw.githubusercontent.com/Outsmart-OOH/ooh_open_direct/master/schema/v1/uris/lines/lines_request.json",
    "Comment": "Free form comment",
    "EndDate": "2020-11-08T00:00:00.000Z",
    "Name": "Big Line 1",
    "ProductId": "456366",
    "OOHProviderData": {
        "PoNumber": "88888"
    },
    "StartDate": "2020-11-02T00:00:00.000Z",
    "Targeting": [
        {
            "Name": "Inventory",
            "Type": "Frames",
            "DataSource": "Space",
            "Target": "frame_id",
            "TargetValues": [
                "1234931339",
                "1235190735",
                "1234931338",
                "1235191547"
            ]
        },
        {
            "Name": "Delivery",
            "Type": "Frames",
            "DataSource": "Time",
            "Target": "Days",
            "TargetValues": [
                "6"
            ]
        },
        {
            "Name": "Delivery",
            "Type": "Frames",
            "DataSource": "Time",
            "Target": "Hours",
            "TargetValues": [
                "7",
                "8",
                "9"
            ]
        },
        {
            "Name": "Delivery",
            "Type": "Frames",
            "DataSource": "ShareOfDisplay",
            "Target": "ShareOfTime",
            "TargetValues": [
                "20"
            ]
        },
        {
            "Name": "Delivery",
            "Type": "Frames",
            "DataSource": "ShareOfDisplay",
            "Target": "Spot",
            "TargetValues": [
                "5"
            ]
        }
    ]
}